[
  {
    "id": "UNFCCC.Forestry.AR-AM0014.v03-0.R-1-0001",
    "logic": "Eligible areas lack forest cover since 31 December 1989 and meet host-country forest thresholds at maturity.",
    "notes": "Document legal right and stakeholder consultation outcomes.",
    "refs": {
      "methodology": "UNFCCC/AR-AM0014@v03-0",
      "primary_section": "S-1",
      "section_anchor": "scope-and-applicability",
      "section_number": "1",
      "section_stable_id": "UNFCCC.Forestry.AR-AM0014.v03-0.S-1",
      "sections": [
        "S-1"
      ],
      "tools": [
        "UNFCCC/AR-AM0014@v03-0"
      ]
    },
    "stable_id": "UNFCCC.Forestry.AR-AM0014.v03-0.R-1-0001",
    "summary": "Projects reforest lands without forest cover since 1989 and comply with national forest definitions.",
    "type": "eligibility",
    "when": [
      "Historical imagery confirms non-forest status since 1989.",
      "National forest definition thresholds documented."
    ]
  },
  {
    "id": "UNFCCC.Forestry.AR-AM0014.v03-0.R-1-0002",
    "logic": "Baseline carbon stock estimates rely on Tool 02 sampling guidance or conservative IPCC defaults.",
    "notes": "Describe sampling design and justify default values.",
    "refs": {
      "methodology": "UNFCCC/AR-AM0014@v03-0",
      "primary_section": "S-2",
      "section_anchor": "baseline-scenario-and-leakage-considerations",
      "section_number": "2",
      "section_stable_id": "UNFCCC.Forestry.AR-AM0014.v03-0.S-2",
      "sections": [
        "S-2"
      ],
      "tools": [
        "UNFCCC/AR-AM0014@v03-0",
        "UNFCCC/AR-TOOL02@v01.0"
      ]
    },
    "stable_id": "UNFCCC.Forestry.AR-AM0014.v03-0.R-1-0002",
    "summary": "Baseline biomass estimated using IPCC defaults or site-specific sampling following Tool 02.",
    "tags": [
      "baseline"
    ],
    "type": "calc",
    "when": [
      "Sampling plan approved during validation.",
      "Baseline strata documentation provided to DOE."
    ]
  },
  {
    "id": "UNFCCC.Forestry.AR-AM0014.v03-0.R-1-0003",
    "logic": "Net anthropogenic GHG removals computed by summing project removals and subtracting baseline emissions and leakage deductions.",
    "notes": "Include harvested wood products where applicable.",
    "refs": {
      "methodology": "UNFCCC/AR-AM0014@v03-0",
      "primary_section": "S-3",
      "section_anchor": "project-scenario-and-carbon-accounting",
      "section_number": "3",
      "section_stable_id": "UNFCCC.Forestry.AR-AM0014.v03-0.S-3",
      "sections": [
        "S-3"
      ],
      "tools": [
        "UNFCCC/AR-AM0014@v03-0",
        "UNFCCC/AR-TOOL08@v04.0.0"
      ]
    },
    "stable_id": "UNFCCC.Forestry.AR-AM0014.v03-0.R-1-0003",
    "summary": "Net anthropogenic removals equal project removals minus baseline emissions and leakage.",
    "type": "equation",
    "when": [
      "All carbon pools accounted for unless exclusion justified.",
      "Leakage deduction applied before reporting net removal."
    ]
  },
  {
    "id": "UNFCCC.Forestry.AR-AM0014.v03-0.R-1-0004",
    "logic": "Activity shifting leakage calculated with Tool 14 standardized factors and subtracted from project removals each monitoring period.",
    "notes": "Describe mitigation with community agreements and land-use controls.",
    "refs": {
      "methodology": "UNFCCC/AR-AM0014@v03-0",
      "primary_section": "S-4",
      "section_anchor": "leakage-assessment-and-mitigation",
      "section_number": "4",
      "section_stable_id": "UNFCCC.Forestry.AR-AM0014.v03-0.S-4",
      "sections": [
        "S-4"
      ],
      "tools": [
        "UNFCCC/AR-AM0014@v03-0",
        "UNFCCC/AR-TOOL14@v04.2"
      ]
    },
    "stable_id": "UNFCCC.Forestry.AR-AM0014.v03-0.R-1-0004",
    "summary": "Activity shifting leakage quantified annually using Tool 14 and deducted from net removals.",
    "type": "leakage",
    "when": [
      "Leakage monitoring indicators collected annually.",
      "Evidence of mitigation actions retained."
    ]
  },
  {
    "id": "UNFCCC.Forestry.AR-AM0014.v03-0.R-1-0005",
    "logic": "Buffer share determined using Tool 15 risk analysis and recorded with registry documentation.",
    "notes": "Update risk analysis if management conditions or tenure change.",
    "refs": {
      "methodology": "UNFCCC/AR-AM0014@v03-0",
      "primary_section": "S-5",
      "section_anchor": "monitoring-qa-qc-and-reporting",
      "section_number": "5",
      "section_stable_id": "UNFCCC.Forestry.AR-AM0014.v03-0.S-5",
      "sections": [
        "S-5"
      ],
      "tools": [
        "UNFCCC/AR-AM0014@v03-0",
        "UNFCCC/AR-TOOL15@v02.0"
      ]
    },
    "stable_id": "UNFCCC.Forestry.AR-AM0014.v03-0.R-1-0005",
    "summary": "Non-permanence risks addressed through buffer contributions per Tool 15 guidance.",
    "type": "monitoring",
    "when": [
      "Risk assessment updated at each verification.",
      "Buffer transactions included in monitoring report."
    ]
  },
  {
    "id": "UNFCCC.Forestry.AR-AM0014.v03-0.R-1-0006",
    "logic": "Permanent sample plots measured at ≤5-year intervals with QA/QC re-measurement requirements.",
    "notes": "Calibration records maintained for all instruments.",
    "refs": {
      "methodology": "UNFCCC/AR-AM0014@v03-0",
      "primary_section": "S-5",
      "section_anchor": "monitoring-qa-qc-and-reporting",
      "section_number": "5",
      "section_stable_id": "UNFCCC.Forestry.AR-AM0014.v03-0.S-5",
      "sections": [
        "S-5"
      ],
      "tools": [
        "UNFCCC/AR-AM0014@v03-0",
        "UNFCCC/AR-TOOL08@v04.0.0"
      ]
    },
    "stable_id": "UNFCCC.Forestry.AR-AM0014.v03-0.R-1-0006",
    "summary": "Field biomass measurements conducted at least every five years using permanent plots.",
    "type": "monitoring",
    "when": [
      "Plot access maintained for full crediting period.",
      "Calibration documentation provided to DOE."
    ]
  },
  {
    "id": "UNFCCC.Forestry.AR-AM0014.v03-0.R-1-0007",
    "logic": "When sampling precision exceeds 10%, apply Tool 12 conservative deductions before issuing credits.",
    "notes": "Include uncertainty worksheets in monitoring report annexes.",
    "refs": {
      "methodology": "UNFCCC/AR-AM0014@v03-0",
      "primary_section": "S-5",
      "section_anchor": "monitoring-qa-qc-and-reporting",
      "section_number": "5",
      "section_stable_id": "UNFCCC.Forestry.AR-AM0014.v03-0.S-5",
      "sections": [
        "S-5"
      ],
      "tools": [
        "UNFCCC/AR-AM0014@v03-0",
        "UNFCCC/AR-TOOL12@v03.1"
      ]
    },
    "stable_id": "UNFCCC.Forestry.AR-AM0014.v03-0.R-1-0007",
    "summary": "Sampling uncertainty above 10% addressed with Tool 12 conservative adjustments.",
    "type": "uncertainty",
    "when": [
      "Confidence interval wider than ±10%.",
      "DOE reviews uncertainty calculation worksheets."
    ]
  },
  {
    "id": "UNFCCC.Forestry.AR-AM0014.v03-0.R-1-0008",
    "logic": "Monitoring submissions include updated spatial data, field measurements, leakage results, and QA/QC documentation.",
    "notes": "Maintain records for at least two crediting periods.",
    "refs": {
      "methodology": "UNFCCC/AR-AM0014@v03-0",
      "primary_section": "S-5",
      "section_anchor": "monitoring-qa-qc-and-reporting",
      "section_number": "5",
      "section_stable_id": "UNFCCC.Forestry.AR-AM0014.v03-0.S-5",
      "sections": [
        "S-5"
      ],
      "tools": [
        "UNFCCC/AR-AM0014@v03-0"
      ]
    },
    "stable_id": "UNFCCC.Forestry.AR-AM0014.v03-0.R-1-0008",
    "summary": "Monitoring reports consolidate maps, inventory data, leakage deductions, and QA/QC evidence.",
    "type": "reporting",
    "when": [
      "Reporting conforms to UNFCCC template.",
      "Supporting datasets archived with version history."
    ]
  }
]
